Nome do Programa,Código do Programa,Nome da IES,Sigla da IES,UF,ME,DO,MP,DP,Av.Capes
"Artes, Patrimônio e Museologia",21001014033P5,FUNDAÇÃO UNIVERSIDADE FEDERAL DO PIAUÍ,FUFPI,PI,-,-,3,-,COMUNICACÃO E INFORMAÇÃO
BIBLIOTECONOMIA,22033017002P3,UNIVERSIDADE FEDERAL DO CARIRI,UFCA,CE,-,-,3,-,COMUNICACÃO E INFORMAÇÃO
BIBLIOTECONOMIA,31021018018P8,UNIVERSIDADE FEDERAL DO ESTADO DO RIO DE JANEIRO,UNIRIO,RJ,-,-,3,-,COMUNICACÃO E INFORMAÇÃO
CIÊNCIA DA INFORMAÇÃO,28001010041P0,UNIVERSIDADE FEDERAL DA BAHIA,UFBA,BA,4,4,-,-,COMUNICACÃO E INFORMAÇÃO
CIÊNCIA DA INFORMAÇÃO,22001018085P8,UNIVERSIDADE FEDERAL DO CEARÁ,UFC,CE,3,-,-,-,COMUNICACÃO E INFORMAÇÃO
CIÊNCIA DA INFORMAÇÃO,33001014052P3,UNIVERSIDADE FEDERAL DE SÃO CARLOS,UFSCAR,SP,3,-,-,-,COMUNICACÃO E INFORMAÇÃO
CIÊNCIA DA INFORMAÇÃO,15001016158P5,UNIVERSIDADE FEDERAL DO PARÁ,UFPA,PA,3,-,-,-,COMUNICACÃO E INFORMAÇÃO
CIÊNCIA DA INFORMAÇÃO,27001016175P0,FUNDAÇÃO UNIVERSIDADE FEDERAL DE SERGIPE,FUFSE,SE,-,-,3,-,COMUNICACÃO E INFORMAÇÃO
CIÊNCIA DA INFORMAÇÃO,31003010063P6,UNIVERSIDADE FEDERAL FLUMINENSE,UFF,RJ,4,4,-,-,COMUNICACÃO E INFORMAÇÃO
CIÊNCIA DA INFORMAÇÃO,42001013176P0,UNIVERSIDADE FEDERAL DO RIO GRANDE DO SUL,UFRGS,RS,A,-,-,-,COMUNICACÃO E INFORMAÇÃO
CIÊNCIA DA INFORMAÇÃO,33004110043P4,"UNIVERSIDADE ESTADUAL PAULISTA JÚLIO DE MESQUITA FILHO, MARÍLIA",UNESP-MAR,SP,6,6,-,-,COMUNICACÃO E INFORMAÇÃO
CIÊNCIA DA INFORMAÇÃO,24001015049P7,"UNIVERSIDADE FEDERAL DA PARAÍBA, JOÃO PESSOA",UFPB-JP,PB,4,4,-,-,COMUNICACÃO E INFORMAÇÃO
CIÊNCIA DA INFORMAÇÃO,33002010195P5,UNIVERSIDADE DE SÃO PAULO,USP,SP,4,4,-,-,COMUNICACÃO E INFORMAÇÃO
CIÊNCIA DA INFORMAÇÃO,25001019077P3,UNIVERSIDADE FEDERAL DE PERNAMBUCO,UFPE,PE,4,4,-,-,COMUNICACÃO E INFORMAÇÃO
CIÊNCIA DA INFORMAÇÃO,30001013108P0,UNIVERSIDADE FEDERAL DO ESPÍRITO SANTO,UFES,ES,A,-,-,-,COMUNICACÃO E INFORMAÇÃO
CIÊNCIA DA INFORMAÇÃO,26001012171P2,UNIVERSIDADE FEDERAL DE ALAGOAS,UFAL,AL,A,-,-,-,COMUNICACÃO E INFORMAÇÃO
CIÊNCIA DA INFORMAÇÃO,41001010052P0,UNIVERSIDADE FEDERAL DE SANTA CATARINA,UFSC,SC,5,5,-,-,COMUNICACÃO E INFORMAÇÃO
Ciência da Informação,40002012048P2,UNIVERSIDADE ESTADUAL DE LONDRINA,UEL,PR,4,4,-,-,COMUNICACÃO E INFORMAÇÃO
CIÊNCIA DA INFORMAÇÃO - UFRJ - IBICT,31001017138P0,UNIVERSIDADE FEDERAL DO RIO DE JANEIRO,UFRJ,RJ,4,4,-,-,COMUNICACÃO E INFORMAÇÃO
CIÊNCIAS DA COMUNICAÇÃO,42007011004P2,UNIVERSIDADE DO VALE DO RIO DOS SINOS,UNISINOS,RS,6,6,-,-,COMUNICACÃO E INFORMAÇÃO
CIÊNCIAS DA COMUNICAÇÃO,33002010096P7,UNIVERSIDADE DE SÃO PAULO,USP,SP,4,4,-,-,COMUNICACÃO E INFORMAÇÃO
CIÊNCIAS DA INFORMAÇÃO,53001010018P0,UNIVERSIDADE DE BRASÍLIA,UNB,DF,5,5,-,-,COMUNICACÃO E INFORMAÇÃO
CIÊNCIAS DA INFORMAÇÃO,32001010028P2,UNIVERSIDADE FEDERAL DE MINAS GERAIS,UFMG,MG,5,5,-,-,COMUNICACÃO E INFORMAÇÃO
CINEMA E AUDIOVISUAL,31003010172P0,UNIVERSIDADE FEDERAL FLUMINENSE,UFF,RJ,4,4,-,-,COMUNICACÃO E INFORMAÇÃO
COMUNICAÇÃO,28022017012P7,UNIVERSIDADE FEDERAL DO RECÔNCAVO DA BAHIA,UFRB,BA,3,-,-,-,COMUNICACÃO E INFORMAÇÃO
COMUNICAÇÃO,32007019049P8,UNIVERSIDADE FEDERAL DE OURO PRETO,UFOP,MG,3,-,-,-,COMUNICACÃO E INFORMAÇÃO
COMUNICAÇÃO,53001010019P6,UNIVERSIDADE DE BRASÍLIA,UNB,DF,4,4,-,-,COMUNICACÃO E INFORMAÇÃO
COMUNICAÇÃO,52001016037P8,UNIVERSIDADE FEDERAL DE GOIÁS,UFG,GO,4,4,-,-,COMUNICACÃO E INFORMAÇÃO
COMUNICAÇÃO,42002010031P1,UNIVERSIDADE FEDERAL DE SANTA MARIA,UFSM,RS,5,5,-,-,COMUNICACÃO E INFORMAÇÃO
COMUNICAÇÃO,40002012034P1,UNIVERSIDADE ESTADUAL DE LONDRINA,UEL,PR,3,-,-,-,COMUNICACÃO E INFORMAÇÃO
COMUNICAÇÃO,33106010003P1,UNIVERSIDADE ANHEMBI MORUMBI,UAM,SP,4,4,-,-,COMUNICACÃO E INFORMAÇÃO
COMUNICAÇÃO,33063010004P6,UNIVERSIDADE PAULISTA,UNIP,SP,4,4,-,-,COMUNICACÃO E INFORMAÇÃO
COMUNICAÇÃO,33018014002P2,FACULDADE CÁSPER LÍBERO,FCL,SP,4,-,-,-,COMUNICACÃO E INFORMAÇÃO
COMUNICAÇÃO,33004056081P4,"UNIVERSIDADE ESTADUAL PAULISTA JÚLIO DE MESQUITA FILHO, BAURU",UNESP-BAURU,SP,4,4,-,-,COMUNICACÃO E INFORMAÇÃO
COMUNICAÇÃO,32005016019P9,UNIVERSIDADE FEDERAL DE JUIZ DE FORA,UFJF,MG,4,4,-,-,COMUNICACÃO E INFORMAÇÃO
COMUNICAÇÃO,31005012029P1,PONTIFÍCIA UNIVERSIDADE CATÓLICA DO RIO DE JANEIRO,PUC-RIO,RJ,4,4,-,-,COMUNICACÃO E INFORMAÇÃO
COMUNICAÇÃO,31004016033P2,UNIVERSIDADE DO ESTADO DO RIO DE JANEIRO,UERJ,RJ,5,5,-,-,COMUNICACÃO E INFORMAÇÃO
COMUNICAÇÃO,31003010040P6,UNIVERSIDADE FEDERAL FLUMINENSE,UFF,RJ,6,6,-,-,COMUNICACÃO E INFORMAÇÃO
COMUNICAÇÃO,31001017064P6,UNIVERSIDADE FEDERAL DO RIO DE JANEIRO,UFRJ,RJ,7,7,-,-,COMUNICACÃO E INFORMAÇÃO
COMUNICAÇÃO,25001019054P3,UNIVERSIDADE FEDERAL DE PERNAMBUCO,UFPE,PE,5,5,-,-,COMUNICACÃO E INFORMAÇÃO
COMUNICAÇÃO,50001019175P6,UNIVERSIDADE FEDERAL DE MATO GROSSO,UFMT,MT,A,-,-,-,COMUNICACÃO E INFORMAÇÃO
COMUNICAÇÃO,22001018063P4,UNIVERSIDADE FEDERAL DO CEARÁ,UFC,CE,4,4,-,-,COMUNICACÃO E INFORMAÇÃO
COMUNICAÇÃO,20001010046P7,UNIVERSIDADE FEDERAL DO MARANHÃO,UFMA,MA,A,-,-,-,COMUNICACÃO E INFORMAÇÃO
COMUNICAÇÃO,13001019040P9,FUNDAÇÃO UNIVERSIDADE FEDERAL DE RORAIMA,UFRR,RR,A,-,-,-,COMUNICACÃO E INFORMAÇÃO
Comunicação,40001016071P8,UNIVERSIDADE FEDERAL DO PARANÁ,UFPR,PR,4,4,-,-,COMUNICACÃO E INFORMAÇÃO
Comunicação,21001014026P9,FUNDAÇÃO UNIVERSIDADE FEDERAL DO PIAUÍ,FUFPI,PI,3,-,-,-,COMUNICACÃO E INFORMAÇÃO
Comunicação,27001016041P4,FUNDAÇÃO UNIVERSIDADE FEDERAL DE SERGIPE,FUFSE,SE,3,-,-,-,COMUNICACÃO E INFORMAÇÃO
Comunicação,51001012031P7,FUNDAÇÃO UNIVERSIDADE FEDERAL DE MATO GROSSO DO SUL,UFMS,MS,3,-,-,-,COMUNICACÃO E INFORMAÇÃO
COMUNICAÇÃO ,20001010048P0,UNIVERSIDADE FEDERAL DO MARANHÃO,UFMA,MA,-,-,A,-,COMUNICACÃO E INFORMAÇÃO
"Comunicação, Cultura e Amazônia",15001016062P8,UNIVERSIDADE FEDERAL DO PARÁ,UFPA,PA,4,4,-,-,COMUNICACÃO E INFORMAÇÃO
COMUNICAÇÃO E CULTURA,33065012002P2,UNIVERSIDADE DE SOROCABA,UNISO,SP,4,4,-,-,COMUNICACÃO E INFORMAÇÃO
COMUNICAÇÃO E CULTURA CONTEMPORÂNEAS,28001010024P9,UNIVERSIDADE FEDERAL DA BAHIA,UFBA,BA,5,5,-,-,COMUNICACÃO E INFORMAÇÃO
COMUNICAÇÃO E CULTURAS MIDIÁTICAS,24001015053P4,"UNIVERSIDADE FEDERAL DA PARAÍBA, JOÃO PESSOA",UFPB-JP,PB,3,-,-,-,COMUNICACÃO E INFORMAÇÃO
COMUNICAÇÃO E INDÚSTRIA CRIATIVA,42046017014P9,FUNDAÇÃO UNIVERSIDADE FEDERAL DO PAMPA,UNIPAMPA,RS,-,-,3,-,COMUNICACÃO E INFORMAÇÃO
COMUNICAÇÃO E LINGUAGENS,40020010003P0,UNIVERSIDADE TUIUTI DO PARANÁ,UTP,PR,5,5,-,-,COMUNICACÃO E INFORMAÇÃO
COMUNICAÇÃO E PRÁTICAS DE CONSUMO,33139016001P3,ESCOLA SUPERIOR DE PROPAGANDA E MARKETING,ESPM,SP,5,5,-,-,COMUNICACÃO E INFORMAÇÃO
COMUNICAÇÃO E SEMIÓTICA,33005010021P0,PONTIFÍCIA UNIVERSIDADE CATÓLICA DE SÃO PAULO,PUC/SP,SP,4,4,-,-,COMUNICACÃO E INFORMAÇÃO
COMUNICAÇÃO E SOCIEDADE,16003012161P1,UNIVERSIDADE FEDERAL DO TOCANTINS,UFT,TO,3,-,-,-,COMUNICACÃO E INFORMAÇÃO
Comunicação e Territorialidades,30001013057P7,UNIVERSIDADE FEDERAL DO ESPÍRITO SANTO,UFES,ES,3,-,-,-,COMUNICACÃO E INFORMAÇÃO
COMUNICAÇÃO SOCIAL,42005019017P4,PONTIFÍCIA UNIVERSIDADE CATÓLICA DO RIO GRANDE DO SUL,PUC/RS,RS,5,5,-,-,COMUNICACÃO E INFORMAÇÃO
COMUNICAÇÃO SOCIAL,32001010052P0,UNIVERSIDADE FEDERAL DE MINAS GERAIS,UFMG,MG,6,6,-,-,COMUNICACÃO E INFORMAÇÃO
COMUNICAÇÃO SOCIAL,33017018004P9,UNIVERSIDADE METODISTA DE SÃO PAULO,UMESP,SP,4,4,-,-,COMUNICACÃO E INFORMAÇÃO
Comunicação Social,32008015016P9,PONTIFÍCIA UNIVERSIDADE CATÓLICA DE MINAS GERAIS,PUC/MG,MG,3,-,-,-,COMUNICACÃO E INFORMAÇÃO
ESTUDOS DA MÍDIA,23001011053P1,UNIVERSIDADE FEDERAL DO RIO GRANDE DO NORTE,UFRN,RN,4,4,-,-,COMUNICACÃO E INFORMAÇÃO
GESTÃO & ORGANIZAÇÃO DO CONHECIMENTO,32001010172P6,UNIVERSIDADE FEDERAL DE MINAS GERAIS,UFMG,MG,5,5,-,-,COMUNICACÃO E INFORMAÇÃO
GESTÃO DA INFORMAÇÃO,33002010248P1,UNIVERSIDADE DE SÃO PAULO,USP,SP,-,-,4,-,COMUNICACÃO E INFORMAÇÃO
Gestão da Informação,41002016025P5,UNIVERSIDADE DO ESTADO DE SANTA CATARINA,UDESC,SC,-,-,3,-,COMUNICACÃO E INFORMAÇÃO
GESTÃO DA INFORMAÇÃO E DO CONHECIMENTO,23001011080P9,UNIVERSIDADE FEDERAL DO RIO GRANDE DO NORTE,UFRN,RN,-,-,3,-,COMUNICACÃO E INFORMAÇÃO
Gestão de Documentos e Arquivos,31021018019P4,UNIVERSIDADE FEDERAL DO ESTADO DO RIO DE JANEIRO,UNIRIO,RJ,-,-,3,-,COMUNICACÃO E INFORMAÇÃO
IMAGEM E SOM,33001014030P0,UNIVERSIDADE FEDERAL DE SÃO CARLOS,UFSCAR,SP,3,-,-,-,COMUNICACÃO E INFORMAÇÃO
INDÚSTRIAS CRIATIVAS,25002015008P8,UNIVERSIDADE CATÓLICA DE PERNAMBUCO,UNICAP,PE,-,-,3,-,COMUNICACÃO E INFORMAÇÃO
Inovação em Comunicação e Economia Criativa,53003012010P8,UNIVERSIDADE CATÓLICA DE BRASÍLIA,UCB,DF,-,-,4,-,COMUNICACÃO E INFORMAÇÃO
INOVAÇÃO NA COMUNICAÇÃO DE INTERESSE PÚBLICO,33110018004P1,UNIVERSIDADE MUNICIPAL DE SÃO CAETANO DO SUL,USCS,SP,-,-,3,-,COMUNICACÃO E INFORMAÇÃO
JORNALISMO,41001010073P7,UNIVERSIDADE FEDERAL DE SANTA CATARINA,UFSC,SC,4,4,-,-,COMUNICACÃO E INFORMAÇÃO
JORNALISMO,24001015068P1,"UNIVERSIDADE FEDERAL DA PARAÍBA, JOÃO PESSOA",UFPB-JP,PB,-,-,3,-,COMUNICACÃO E INFORMAÇÃO
Jornalismo,40005011015P6,UNIVERSIDADE ESTADUAL DE PONTA GROSSA,UEPG,PR,3,-,-,-,COMUNICACÃO E INFORMAÇÃO
Meios e Processos Audiovisuais,33002010212P7,UNIVERSIDADE DE SÃO PAULO,USP,SP,4,4,-,-,COMUNICACÃO E INFORMAÇÃO
MEMÓRIA E ACERVOS,33301000001P0,FUNDAÇÃO CASA DE RUI BARBOSA,FCRB,RJ,-,-,3,-,COMUNICACÃO E INFORMAÇÃO
Mídia e Cotidiano,31003010088P9,UNIVERSIDADE FEDERAL FLUMINENSE,UFF,RJ,4,4,-,-,COMUNICACÃO E INFORMAÇÃO
Mídias Criativas,31001017166P3,UNIVERSIDADE FEDERAL DO RIO DE JANEIRO,UFRJ,RJ,-,-,3,-,COMUNICACÃO E INFORMAÇÃO
MULTIMEIOS,33003017044P3,UNIVERSIDADE ESTADUAL DE CAMPINAS,UNICAMP,SP,3,3,-,-,COMUNICACÃO E INFORMAÇÃO
Museologia,28001010093P0,UNIVERSIDADE FEDERAL DA BAHIA,UFBA,BA,3,-,-,-,COMUNICACÃO E INFORMAÇÃO
Museologia,33002010226P8,UNIVERSIDADE DE SÃO PAULO,USP,SP,3,-,-,-,COMUNICACÃO E INFORMAÇÃO
MUSEOLOGIA E PATRIMÔNIO,42001013173P0,UNIVERSIDADE FEDERAL DO RIO GRANDE DO SUL,UFRGS,RS,3,-,-,-,COMUNICACÃO E INFORMAÇÃO
MUSEOLOGIA E PATRIMÖNIO,31021018008P2,UNIVERSIDADE FEDERAL DO ESTADO DO RIO DE JANEIRO,UNIRIO,RJ,4,4,-,-,COMUNICACÃO E INFORMAÇÃO
Preservação de Acervos de Ciência e Tecnologia,31055010001P2,MUSEU DE ASTRONOMIA E CIÊNCIAS AFINS,MAST,RJ,-,-,3,-,COMUNICACÃO E INFORMAÇÃO
PRODUÇÃO JORNALÍSTICA E MERCADO MPPJM,33139016004P2,ESCOLA SUPERIOR DE PROPAGANDA E MARKETING,ESPM,SP,-,-,3,-,COMUNICACÃO E INFORMAÇÃO
Programa de Pós-Graduação em Comunicação,42001013062P4,UNIVERSIDADE FEDERAL DO RIO GRANDE DO SUL,UFRGS,RS,5,5,-,-,COMUNICACÃO E INFORMAÇÃO
Sistemas de Informação e Gestão do Conhecimento,32053010003P1,UNIVERSIDADE FUMEC,FUMEC,MG,4,4,-,-,COMUNICACÃO E INFORMAÇÃO
"Tecnologias, Comunicação e Educação",32006012033P8,UNIVERSIDADE FEDERAL DE UBERLÂNDIA,UFU,MG,-,-,4,-,COMUNICACÃO E INFORMAÇÃO