Nome do Programa,Código do Programa,Nome da IES,Sigla da IES,UF,ME,DO,MP,DP,Av.Capes
Ensino de História,31001017155P1,UNIVERSIDADE FEDERAL DO RIO DE JANEIRO,UFRJ,RJ,-,-,4,-,HISTORIA
"ESTUDOS AFRICANOS, POVOS INDÍGENAS E CULTURAS NEGRAS",28005015071P9,UNIVERSIDADE DO ESTADO DA BAHIA,UNEB,BA,3,-,-,-,HISTORIA
ESTUDOS CULTURAIS MEMORIA E PATRIMÔNIO,52012018014P6,UNIVERSIDADE ESTADUAL DE GOIÁS,UEG,GO,-,-,A,-,HISTORIA
HISTORIA,32014015008P2,UNIVERSIDADE ESTADUAL DE MONTES CLAROS,UNIMONTES,MG,3,-,-,-,HISTORIA
HISTORIA,52001016066P8,UNIVERSIDADE FEDERAL DE GOIÁS,UFG,GO,-,-,3,-,HISTORIA
HISTORIA,31021018010P7,UNIVERSIDADE FEDERAL DO ESTADO DO RIO DE JANEIRO,UNIRIO,RJ,5,5,-,-,HISTORIA
HISTÓRIA,12001015023P4,UNIVERSIDADE FEDERAL DO AMAZONAS,UFAM,AM,4,4,-,-,HISTORIA
HISTÓRIA,15001016043P3,UNIVERSIDADE FEDERAL DO PARÁ,UFPA,PA,5,5,-,-,HISTORIA
HISTÓRIA,20001010024P3,UNIVERSIDADE FEDERAL DO MARANHÃO,UFMA,MA,4,4,-,-,HISTORIA
HISTÓRIA,21001014009P7,FUNDAÇÃO UNIVERSIDADE FEDERAL DO PIAUÍ,FUFPI,PI,4,4,-,-,HISTORIA
HISTÓRIA,22001018033P8,UNIVERSIDADE FEDERAL DO CEARÁ,UFC,CE,4,4,-,-,HISTORIA
HISTÓRIA,23001011038P2,UNIVERSIDADE FEDERAL DO RIO GRANDE DO NORTE,UFRN,RN,4,4,-,-,HISTORIA
HISTÓRIA,24001015045P1,"UNIVERSIDADE FEDERAL DA PARAÍBA, JOÃO PESSOA",UFPB-JP,PB,3,-,-,-,HISTORIA
HISTÓRIA,24009016018P5,UNIVERSIDADE FEDERAL DE CAMPINA GRANDE,UFCG,PB,3,-,-,-,HISTORIA
HISTÓRIA,25001019015P8,UNIVERSIDADE FEDERAL DE PERNAMBUCO,UFPE,PE,4,4,-,-,HISTORIA
HISTÓRIA,25003011019P6,UNIVERSIDADE FEDERAL RURAL DE PERNAMBUCO,UFRPE,PE,4,4,-,-,HISTORIA
HISTÓRIA,28001010022P6,UNIVERSIDADE FEDERAL DA BAHIA,UFBA,BA,4,4,-,-,HISTORIA
HISTÓRIA,28002016009P2,UNIVERSIDADE ESTADUAL DE FEIRA DE SANTANA,UEFS,BA,3,-,-,-,HISTORIA
HISTÓRIA,30001013017P5,UNIVERSIDADE FEDERAL DO ESPÍRITO SANTO,UFES,ES,5,5,-,-,HISTORIA
HISTÓRIA,31002013019P7,UNIVERSIDADE FEDERAL RURAL DO RIO DE JANEIRO,UFRRJ,RJ,5,5,-,-,HISTORIA
HISTÓRIA,31003010005P6,UNIVERSIDADE FEDERAL FLUMINENSE,UFF,RJ,7,7,-,-,HISTORIA
HISTÓRIA,31004016024P3,UNIVERSIDADE DO ESTADO DO RIO DE JANEIRO,UERJ,RJ,5,5,-,-,HISTORIA
HISTÓRIA,31025013003P6,UNIVERSIDADE SALGADO DE OLIVEIRA,UNIVERSO,RJ,4,4,-,-,HISTORIA
HISTÓRIA,32001010043P1,UNIVERSIDADE FEDERAL DE MINAS GERAIS,UFMG,MG,7,7,-,-,HISTORIA
HISTÓRIA,32005016010P1,UNIVERSIDADE FEDERAL DE JUIZ DE FORA,UFJF,MG,5,5,-,-,HISTORIA
HISTÓRIA,32006012012P0,UNIVERSIDADE FEDERAL DE UBERLÂNDIA,UFU,MG,3,-,-,-,HISTORIA
HISTÓRIA,32018010003P6,UNIVERSIDADE FEDERAL DE SÃO JOÃO DEL-REI,UFSJ,MG,3,-,-,-,HISTORIA
HISTÓRIA,33003017019P9,UNIVERSIDADE ESTADUAL DE CAMPINAS,UNICAMP,SP,6,6,-,-,HISTORIA
HISTÓRIA,33004048018P5,"UNIVERSIDADE ESTADUAL PAULISTA JÚLIO DE MESQUITA FILHO, ASSIS",UNESP-ASSIS,SP,4,4,-,-,HISTORIA
HISTÓRIA,33004072013P0,"UNIVERSIDADE ESTADUAL PAULISTA JÚLIO DE MESQUITA FILHO, FRANCA",UNESP-FR,SP,5,5,-,-,HISTORIA
HISTÓRIA,33005010010P8,PONTIFÍCIA UNIVERSIDADE CATÓLICA DE SÃO PAULO,PUC/SP,SP,4,4,-,-,HISTORIA
HISTÓRIA,40001016009P0,UNIVERSIDADE FEDERAL DO PARANÁ,UFPR,PR,5,5,-,-,HISTORIA
HISTÓRIA,40004015025P5,UNIVERSIDADE ESTADUAL DE MARINGÁ,UEM,PR,4,4,-,-,HISTORIA
HISTÓRIA,41001010004P5,UNIVERSIDADE FEDERAL DE SANTA CATARINA,UFSC,SC,4,4,-,-,HISTORIA
HISTÓRIA,41002016013P7,UNIVERSIDADE DO ESTADO DE SANTA CATARINA,UDESC,SC,5,5,-,-,HISTORIA
HISTÓRIA,42001013043P0,UNIVERSIDADE FEDERAL DO RIO GRANDE DO SUL,UFRGS,RS,6,6,-,-,HISTORIA
HISTÓRIA,42002010051P2,UNIVERSIDADE FEDERAL DE SANTA MARIA,UFSM,RS,4,4,-,-,HISTORIA
HISTÓRIA,42004012023P8,UNIVERSIDADE FEDERAL DO RIO GRANDE,FURG,RS,-,-,4,-,HISTORIA
HISTÓRIA,42005019005P6,PONTIFÍCIA UNIVERSIDADE CATÓLICA DO RIO GRANDE DO SUL,PUC/RS,RS,5,5,-,-,HISTORIA
HISTÓRIA,42007011001P3,UNIVERSIDADE DO VALE DO RIO DOS SINOS,UNISINOS,RS,5,5,-,-,HISTORIA
HISTÓRIA,42009014003P9,FUNDAÇÃO UNIVERSIDADE DE PASSO FUNDO,FUPF,RS,4,4,-,-,HISTORIA
HISTÓRIA,50001019005P3,UNIVERSIDADE FEDERAL DE MATO GROSSO,UFMT,MT,4,4,-,-,HISTORIA
HISTÓRIA,51005018002P2,UNIVERSIDADE FEDERAL DA GRANDE DOURADOS,UFGD,MS,4,4,-,-,HISTORIA
HISTÓRIA,52001016002P0,UNIVERSIDADE FEDERAL DE GOIÁS,UFG,GO,5,5,-,-,HISTORIA
HISTÓRIA,52002012013P8,PONTIFÍCIA UNIVERSIDADE CATÓLICA DE GOIÁS,PUC-GOIÁS,GO,3,-,-,-,HISTORIA
HISTÓRIA,53001010011P5,UNIVERSIDADE DE BRASÍLIA,UNB,DF,4,4,-,-,HISTORIA
HISTÓRIA,28005015070P2,UNIVERSIDADE DO ESTADO DA BAHIA,UNEB,BA,3,-,-,-,HISTORIA
HISTÓRIA,41020014008P4,UNIVERSIDADE FEDERAL DA FRONTEIRA SUL,UFFS,SC,3,-,-,-,HISTORIA
HISTÓRIA,25002015009P4,UNIVERSIDADE CATÓLICA DE PERNAMBUCO,UNICAP,PE,-,-,3,-,HISTORIA
HISTÓRIA,23001011179P5,UNIVERSIDADE FEDERAL DO RIO GRANDE DO NORTE,UFRN,RN,A,-,-,-,HISTORIA
HISTÓRIA,14001012159P9,UNIVERSIDADE FEDERAL DO AMAPÁ,UNIFAP,AP,A,-,-,-,HISTORIA
HISTÓRIA,15025012073P9,UNIVERSIDADE FEDERAL DO SUL E SUDESTE DO PARÁ,UNIFESSPA,PA,A,-,-,-,HISTORIA
HISTÓRIA,52012018013P0,UNIVERSIDADE ESTADUAL DE GOIÁS,UEG,GO,A,-,-,-,HISTORIA
HISTÓRIA,40076016007P2,UNIVERSIDADE ESTADUAL DO PARANÁ,UNESPAR,PR,A,-,-,-,HISTORIA
História,26001012034P5,UNIVERSIDADE FEDERAL DE ALAGOAS,UFAL,AL,3,-,-,-,HISTORIA
História,40005011014P0,UNIVERSIDADE ESTADUAL DE PONTA GROSSA,UEPG,PR,3,-,-,-,HISTORIA
História,27001016043P7,FUNDAÇÃO UNIVERSIDADE FEDERAL DE SERGIPE,FUFSE,SE,3,-,-,-,HISTORIA
História,33009015078P3,UNIVERSIDADE FEDERAL DE SÃO PAULO,UNIFESP,SP,3,-,-,-,HISTORIA
História,40015017007P5,UNIVERSIDADE ESTADUAL DO OESTE DO PARANA,UNIOESTE,PR,4,4,-,-,HISTORIA
História,32007019015P6,UNIVERSIDADE FEDERAL DE OURO PRETO,UFOP,MG,5,5,-,-,HISTORIA
História,42003016036P6,UNIVERSIDADE FEDERAL DE PELOTAS,UFPEL,RS,4,4,-,-,HISTORIA
História,42008018016P7,UNIVERSIDADE DE CAXIAS DO SUL,UCS,RS,-,-,4,-,HISTORIA
História,20002017008P4,UNIVERSIDADE ESTADUAL DO MARANHÃO,UEMA,MA,-,-,4,4,HISTORIA
Hístória,40014010008P5,UNIVERSIDADE ESTADUAL DO CENTRO-OESTE,UNICENTRO,PR,3,-,-,-,HISTORIA
HISTÓRIA ,40043010010P9,UNIVERSIDADE FEDERAL DA INTEGRAÇÃO LATINO-AMERICANA,UNILA,PR,A,-,-,-,HISTORIA
HISTÓRIA: ATLÂNTICO E DIÁSPORA AFRICANA,28007018076P3,UNIVERSIDADE ESTADUAL DE SANTA CRUZ,UESC,BA,A,-,-,-,HISTORIA
HISTÓRIA COMPARADA,31001017119P5,UNIVERSIDADE FEDERAL DO RIO DE JANEIRO,UFRJ,RJ,4,4,-,-,HISTORIA
"HISTÓRIA, CULTURAS E ESPACIALIDADES",22003010075P5,UNIVERSIDADE ESTADUAL DO CEARÁ,UECE,CE,A,-,-,-,HISTORIA
"HISTÓRIA DA ÁFRICA, DA DIÁSPORA E DOS POVOS INDÍGENAS",28022017011P0,UNIVERSIDADE FEDERAL DO RECÔNCAVO DA BAHIA,UFRB,BA,-,-,3,-,HISTORIA
HISTÓRIA DA AMAZÔNIA,10001018045P2,UNIVERSIDADE FEDERAL DE RONDÔNIA,UNIR,RO,A,-,-,-,HISTORIA
HISTÓRIA DAS CIÊNCIAS,31010016006P1,FUNDAÇÃO OSWALDO CRUZ - FIOCRUZ,FIOCRUZ,RJ,5,5,-,-,HISTORIA
HISTÓRIA DAS POPULAÇÕES AMAZÔNICAS,16003012174P6,UNIVERSIDADE FEDERAL DO TOCANTINS,UFT,TO,-,-,A,-,HISTORIA
HISTÓRIA ECONÔMICA,33002010033P5,UNIVERSIDADE DE SÃO PAULO,USP,SP,3,3,-,-,HISTORIA
História Ibérica,32011016014P3,UNIVERSIDADE FEDERAL DE ALFENAS,UNIFAL,MG,-,-,3,-,HISTORIA
"HISTÓRIA, POLÍTICA E BENS CULTURAIS",31011012012P8,FUNDAÇÃO GETÚLIO VARGAS,FGV,RJ,5,5,-,-,HISTORIA
"HISTÓRIA, POLÍTICA E BENS CULTURAIS",31011012009P7,FUNDAÇÃO GETÚLIO VARGAS,FGV,RJ,-,-,5,-,HISTORIA
HISTÓRIA REGIONAL E LOCAL,28005015007P9,UNIVERSIDADE DO ESTADO DA BAHIA,UNEB,BA,3,-,-,-,HISTORIA
HISTÓRIA SOCIAL,31001017023P8,UNIVERSIDADE FEDERAL DO RIO DE JANEIRO,UFRJ,RJ,6,6,-,-,HISTORIA
HISTÓRIA SOCIAL,31004016046P7,UNIVERSIDADE DO ESTADO DO RIO DE JANEIRO,UERJ,RJ,4,4,-,-,HISTORIA
HISTÓRIA SOCIAL,33002010032P9,UNIVERSIDADE DE SÃO PAULO,USP,SP,6,6,-,-,HISTORIA
HISTÓRIA SOCIAL,40002012032P9,UNIVERSIDADE ESTADUAL DE LONDRINA,UEL,PR,3,-,-,-,HISTORIA
HISTÓRIA SOCIAL  DA CULTURA,31005012024P0,PONTIFÍCIA UNIVERSIDADE CATÓLICA DO RIO DE JANEIRO,PUC-RIO,RJ,5,5,-,-,HISTORIA
"Patrimônio Cultural, Paisagens e Cidadania",32002017048P0,UNIVERSIDADE FEDERAL DE VIÇOSA,UFV,MG,-,-,3,-,HISTORIA