Nome do Programa,Código do Programa,Nome da IES,Sigla da IES,UF,ME,DO,MP,DP,Av.Capes
 Estudos da Linguagem,40005011012P7,UNIVERSIDADE ESTADUAL DE PONTA GROSSA,UEPG,PR,4,-,-,-,LETRAS / LINGUÍSTICA
 LINGUÍSTICA E LÍNGUAS INDÍGENAS,31001017167P0,UNIVERSIDADE FEDERAL DO RIO DE JANEIRO,UFRJ,RJ,-,-,3,-,LETRAS / LINGUÍSTICA
CIÊNCIAS DA LINGUAGEM,23002018073P9,UNIVERSIDADE DO ESTADO DO RIO GRANDE DO NORTE,UERN,RN,3,-,-,-,LETRAS / LINGUÍSTICA
CIÊNCIAS DA LINGUAGEM,25002015003P6,UNIVERSIDADE CATÓLICA DE PERNAMBUCO,UNICAP,PE,5,5,-,-,LETRAS / LINGUÍSTICA
CIÊNCIAS DA LINGUAGEM,41008014001P7,UNIVERSIDADE DO SUL DE SANTA CATARINA,UNISUL,SC,5,5,-,-,LETRAS / LINGUÍSTICA
Ciências da linguagem,32073011001P2,UNIVERSIDADE DO VALE DO SAPUCAÍ,UNIVAS,MG,4,4,-,-,LETRAS / LINGUÍSTICA
CRÍTICA CULTURAL,28005015008P5,UNIVERSIDADE DO ESTADO DA BAHIA,UNEB,BA,4,4,-,-,LETRAS / LINGUÍSTICA
EDUCAÇÃO BILÍNGUE,31047017001P0,INSTITUTO NACIONAL DE EDUCAÇÃO DE SURDOS,INES,RJ,-,-,A,-,LETRAS / LINGUÍSTICA
ENSINO DE LÍNGUA PORTUGUESA E SUAS RESPECTIVAS LITERATURAS          ,15006018010P0,UNIVERSIDADE DO ESTADO DO PARÁ,UEPA,PA,-,-,A,-,LETRAS / LINGUÍSTICA
Ensino de Línguas,42046017010P3,FUNDAÇÃO UNIVERSIDADE FEDERAL DO PAMPA,UNIPAMPA,RS,-,-,3,-,LETRAS / LINGUÍSTICA
ESTUDO DE LINGUAGENS,28005015003P3,UNIVERSIDADE DO ESTADO DA BAHIA,UNEB,BA,4,-,-,-,LETRAS / LINGUÍSTICA
ESTUDOS DA LINGUAGEM,23001011013P0,UNIVERSIDADE FEDERAL DO RIO GRANDE DO NORTE,UFRN,RN,5,5,-,-,LETRAS / LINGUÍSTICA
ESTUDOS DA LINGUAGEM,25003011075P3,UNIVERSIDADE FEDERAL RURAL DE PERNAMBUCO,UFRPE,PE,A,-,-,-,LETRAS / LINGUÍSTICA
ESTUDOS DA LINGUAGEM,22011013004P0,UNIVERSIDADE DA INTEGRAÇÃO INTERNACIONAL DA LUSOFONIA AFRO-BRASILEIRA,UNILAB,CE,A,-,-,-,LETRAS / LINGUÍSTICA
ESTUDOS DA LINGUAGEM,52001016049P6,UNIVERSIDADE FEDERAL DE GOIÁS,UFG,GO,4,4,-,-,LETRAS / LINGUÍSTICA
ESTUDOS DA LINGUAGEM,40002012022P3,UNIVERSIDADE ESTADUAL DE LONDRINA,UEL,PR,5,5,-,-,LETRAS / LINGUÍSTICA
Estudos da linguagem,31005012037P4,PONTIFÍCIA UNIVERSIDADE CATÓLICA DO RIO DE JANEIRO,PUC-RIO,RJ,5,5,-,-,LETRAS / LINGUÍSTICA
ESTUDOS DA TRADUÇÃO,41001010053P6,UNIVERSIDADE FEDERAL DE SANTA CATARINA,UFSC,SC,6,6,-,-,LETRAS / LINGUÍSTICA
ESTUDOS DA TRADUÇÃO,33002010224P5,UNIVERSIDADE DE SÃO PAULO,USP,SP,4,4,-,-,LETRAS / LINGUÍSTICA
Estudos da Tradução,22001018083P5,UNIVERSIDADE FEDERAL DO CEARÁ,UFC,CE,3,-,-,-,LETRAS / LINGUÍSTICA
ESTUDOS DE LINGUAGEM,50001019008P2,UNIVERSIDADE FEDERAL DE MATO GROSSO,UFMT,MT,4,4,-,-,LETRAS / LINGUÍSTICA
Estudos de Linguagem,31003010073P1,UNIVERSIDADE FEDERAL FLUMINENSE,UFF,RJ,5,5,-,-,LETRAS / LINGUÍSTICA
ESTUDOS DE LINGUAGENS,32020015006P6,CENTRO FEDERAL DE EDUCAÇÃO TECNOLÓGICA DE MINAS GERAIS,CEFET,MG,4,4,-,-,LETRAS / LINGUÍSTICA
ESTUDOS DE LINGUAGENS,51001012020P5,FUNDAÇÃO UNIVERSIDADE FEDERAL DE MATO GROSSO DO SUL,UFMS,MS,4,4,-,-,LETRAS / LINGUÍSTICA
ESTUDOS DE LINGUAGENS,40006018035P3,UNIVERSIDADE TECNOLÓGICA FEDERAL DO PARANÁ,UTFPR,PR,3,-,-,-,LETRAS / LINGUÍSTICA
Estudos de Literatura,31003010074P8,UNIVERSIDADE FEDERAL FLUMINENSE,UFF,RJ,6,6,-,-,LETRAS / LINGUÍSTICA
Estudos de literatura,33001014041P1,UNIVERSIDADE FEDERAL DE SÃO CARLOS,UFSCAR,SP,4,4,-,-,LETRAS / LINGUÍSTICA
Estudos de Tradução,53001010091P9,UNIVERSIDADE DE BRASÍLIA,UNB,DF,4,-,-,-,LETRAS / LINGUÍSTICA
Estudos Judaicos e Arabes,33002010216P2,UNIVERSIDADE DE SÃO PAULO,USP,SP,3,-,-,-,LETRAS / LINGUÍSTICA
ESTUDOS LINGÜÍSTICOS,33004153069P5,"UNIVERSIDADE ESTADUAL PAULISTA JÚLIO DE MESQUITA FILHO, SÃO JOSÉ DO RIO PRETO",UNESP-SJRP,SP,6,6,-,-,LETRAS / LINGUÍSTICA
ESTUDOS LINGÜÍSTICOS,32001010057P2,UNIVERSIDADE FEDERAL DE MINAS GERAIS,UFMG,MG,7,7,-,-,LETRAS / LINGUÍSTICA
ESTUDOS LINGÜÍSTICOS,32006012007P7,UNIVERSIDADE FEDERAL DE UBERLÂNDIA,UFU,MG,5,5,-,-,LETRAS / LINGUÍSTICA
Estudos Linguísticos,41020014001P0,UNIVERSIDADE FEDERAL DA FRONTEIRA SUL,UFFS,SC,4,-,-,-,LETRAS / LINGUÍSTICA
Estudos Linguísticos,28002016012P3,UNIVERSIDADE ESTADUAL DE FEIRA DE SANTANA,UEFS,BA,4,4,-,-,LETRAS / LINGUÍSTICA
ESTUDOS LINGUÍSTICOS  E LITERÁRIOS EM INGLÊS,33002010109P1,UNIVERSIDADE DE SÃO PAULO,USP,SP,4,4,-,-,LETRAS / LINGUÍSTICA
ESTUDOS LITERÁRIOS,32001010056P6,UNIVERSIDADE FEDERAL DE MINAS GERAIS,UFMG,MG,7,7,-,-,LETRAS / LINGUÍSTICA
ESTUDOS LITERÁRIOS,33004030016P0,"UNIVERSIDADE ESTADUAL PAULISTA JÚLIO DE MESQUITA FILHO, ARARAQUARA",UNESP-ARAR,SP,6,6,-,-,LETRAS / LINGUÍSTICA
Estudos Literários,50002015004P3,UNIVERSIDADE DO ESTADO DE MATO GROSSO,UNEMAT,MT,4,4,-,-,LETRAS / LINGUÍSTICA
Estudos Literários,32006012022P6,UNIVERSIDADE FEDERAL DE UBERLÂNDIA,UFU,MG,4,4,-,-,LETRAS / LINGUÍSTICA
Estudos Literários,10001018012P7,UNIVERSIDADE FEDERAL DE RONDÔNIA,UNIR,RO,3,-,-,-,LETRAS / LINGUÍSTICA
Estudos Literários,28002016003P4,UNIVERSIDADE ESTADUAL DE FEIRA DE SANTANA,UEFS,BA,4,-,-,-,LETRAS / LINGUÍSTICA
FILOLOGIA E LÍNGUA PORTUGUESA,33002010107P9,UNIVERSIDADE DE SÃO PAULO,USP,SP,4,4,-,-,LETRAS / LINGUÍSTICA
Inglês:Estudos Lingüísticos e Literários,41001010012P8,UNIVERSIDADE FEDERAL DE SANTA CATARINA,UFSC,SC,5,5,-,-,LETRAS / LINGUÍSTICA
INTERDISCIPLINAR LINGÜÍSTICA APLICADA,31001017085P3,UNIVERSIDADE FEDERAL DO RIO DE JANEIRO,UFRJ,RJ,4,4,-,-,LETRAS / LINGUÍSTICA
LETRAS,40001016016P7,UNIVERSIDADE FEDERAL DO PARANÁ,UFPR,PR,6,6,-,-,LETRAS / LINGUÍSTICA
LETRAS,40002012012P8,UNIVERSIDADE ESTADUAL DE LONDRINA,UEL,PR,4,4,-,-,LETRAS / LINGUÍSTICA
LETRAS,40004015014P3,UNIVERSIDADE ESTADUAL DE MARINGÁ,UEM,PR,5,5,-,-,LETRAS / LINGUÍSTICA
LETRAS,42001013031P1,UNIVERSIDADE FEDERAL DO RIO GRANDE DO SUL,UFRGS,RS,7,7,-,-,LETRAS / LINGUÍSTICA
LETRAS,42002010014P0,UNIVERSIDADE FEDERAL DE SANTA MARIA,UFSM,RS,5,5,-,-,LETRAS / LINGUÍSTICA
LETRAS,42004012010P3,UNIVERSIDADE FEDERAL DO RIO GRANDE,FURG,RS,4,4,-,-,LETRAS / LINGUÍSTICA
LETRAS,42009014005P1,FUNDAÇÃO UNIVERSIDADE DE PASSO FUNDO,FUPF,RS,5,5,-,-,LETRAS / LINGUÍSTICA
LETRAS,42010012002P7,UNIVERSIDADE REGIONAL INTEGRADA DO ALTO URUGUAI E DAS MISSÕES,URI,RS,4,-,-,-,LETRAS / LINGUÍSTICA
LETRAS,42020018003P5,UNIVERSIDADE DE SANTA CRUZ DO SUL,UNISC,RS,4,4,-,-,LETRAS / LINGUÍSTICA
LETRAS,42043018001P5,CENTRO UNIVERSITÁRIO RITTER DOS REIS,UNIRITTER,RS,4,-,-,-,LETRAS / LINGUÍSTICA
LETRAS,51001012011P6,FUNDAÇÃO UNIVERSIDADE FEDERAL DE MATO GROSSO DO SUL,UFMS,MS,4,4,-,-,LETRAS / LINGUÍSTICA
LETRAS,52002012010P9,PONTIFÍCIA UNIVERSIDADE CATÓLICA DE GOIÁS,PUC-GOIÁS,GO,3,-,-,-,LETRAS / LINGUÍSTICA
LETRAS,23001011069P5,UNIVERSIDADE FEDERAL DO RIO GRANDE DO NORTE,UFRN,RN,-,-,4,-,LETRAS / LINGUÍSTICA
LETRAS,32032013002P5,CENTRO DE ENSINO SUPERIOR DE JUIZ DE FORA,CES-JF,MG,3,-,-,-,LETRAS / LINGUÍSTICA
LETRAS,40006018036P0,UNIVERSIDADE TECNOLÓGICA FEDERAL DO PARANÁ,UTFPR,PR,3,-,-,-,LETRAS / LINGUÍSTICA
LETRAS,16003012159P7,UNIVERSIDADE FEDERAL DO TOCANTINS,UFT,TO,3,-,-,-,LETRAS / LINGUÍSTICA
LETRAS,42041015008P7,UNIVERSIDADE FEEVALE,FEEVALE,RS,-,-,3,-,LETRAS / LINGUÍSTICA
LETRAS,20002017040P5,UNIVERSIDADE ESTADUAL DO MARANHÃO,UEMA,MA,3,-,-,-,LETRAS / LINGUÍSTICA
LETRAS,50002015156P8,UNIVERSIDADE DO ESTADO DE MATO GROSSO,UNEMAT,MT,3,-,-,-,LETRAS / LINGUÍSTICA
LETRAS,15025012070P0,UNIVERSIDADE FEDERAL DO SUL E SUDESTE DO PARÁ,UNIFESSPA,PA,3,-,-,-,LETRAS / LINGUÍSTICA
LETRAS,14001012160P7,UNIVERSIDADE FEDERAL DO AMAPÁ,UNIFAP,AP,A,-,-,-,LETRAS / LINGUÍSTICA
LETRAS,32004010047P0,UNIVERSIDADE FEDERAL DE LAVRAS,UFLA,MG,A,-,-,-,LETRAS / LINGUÍSTICA
LETRAS,22005013005P0,UNIVERSIDADE REGIONAL DO CARIRI,URCA,CE,A,-,-,-,LETRAS / LINGUÍSTICA
LETRAS,20001010052P7,UNIVERSIDADE FEDERAL DO MARANHÃO,UFMA,MA,A,-,-,-,LETRAS / LINGUÍSTICA
LETRAS,21018006001P7,UNIVERSIDADE ESTADUAL DA REGIÃO TOCANTINA DO MARANHÃO,UEMASUL,MA,-,-,A,-,LETRAS / LINGUÍSTICA
LETRAS,12001015037P5,UNIVERSIDADE FEDERAL DO AMAZONAS,UFAM,AM,3,-,-,-,LETRAS / LINGUÍSTICA
LETRAS,13001019005P9,FUNDAÇÃO UNIVERSIDADE FEDERAL DE RORAIMA,UFRR,RR,3,-,-,-,LETRAS / LINGUÍSTICA
LETRAS,21001014008P0,FUNDAÇÃO UNIVERSIDADE FEDERAL DO PIAUÍ,FUFPI,PI,4,4,-,-,LETRAS / LINGUÍSTICA
LETRAS,21002010001P2,FUNDAÇÃO UNIVERSIDADE ESTADUAL DO PIAUÍ,FUESPI,PI,4,-,-,-,LETRAS / LINGUÍSTICA
LETRAS,22001018018P9,UNIVERSIDADE FEDERAL DO CEARÁ,UFC,CE,4,4,-,-,LETRAS / LINGUÍSTICA
LETRAS,23002018004P7,UNIVERSIDADE DO ESTADO DO RIO GRANDE DO NORTE,UERN,RN,4,4,-,-,LETRAS / LINGUÍSTICA
LETRAS,24001015051P1,"UNIVERSIDADE FEDERAL DA PARAÍBA, JOÃO PESSOA",UFPB-JP,PB,4,4,-,-,LETRAS / LINGUÍSTICA
LETRAS,25001019032P0,UNIVERSIDADE FEDERAL DE PERNAMBUCO,UFPE,PE,4,4,-,-,LETRAS / LINGUÍSTICA
LETRAS,27001016021P3,FUNDAÇÃO UNIVERSIDADE FEDERAL DE SERGIPE,FUFSE,SE,4,4,-,-,LETRAS / LINGUÍSTICA
LETRAS,30001013013P0,UNIVERSIDADE FEDERAL DO ESPÍRITO SANTO,UFES,ES,5,5,-,-,LETRAS / LINGUÍSTICA
LETRAS,31004016009P4,UNIVERSIDADE DO ESTADO DO RIO DE JANEIRO,UERJ,RJ,5,5,-,-,LETRAS / LINGUÍSTICA
LETRAS,32002017038P4,UNIVERSIDADE FEDERAL DE VIÇOSA,UFV,MG,4,-,-,-,LETRAS / LINGUÍSTICA
LETRAS,32008015001P1,PONTIFÍCIA UNIVERSIDADE CATÓLICA DE MINAS GERAIS,PUC/MG,MG,5,5,-,-,LETRAS / LINGUÍSTICA
LETRAS,33004048019P1,"UNIVERSIDADE ESTADUAL PAULISTA JÚLIO DE MESQUITA FILHO, ASSIS",UNESP-ASSIS,SP,5,5,-,-,LETRAS / LINGUÍSTICA
LETRAS,33004153015P2,"UNIVERSIDADE ESTADUAL PAULISTA JÚLIO DE MESQUITA FILHO, SÃO JOSÉ DO RIO PRETO",UNESP-SJRP,SP,6,6,-,-,LETRAS / LINGUÍSTICA
LETRAS,33024014015P3,UNIVERSIDADE PRESBITERIANA MACKENZIE,UPM,SP,6,6,-,-,LETRAS / LINGUÍSTICA
Letras,40014010007P9,UNIVERSIDADE ESTADUAL DO CENTRO-OESTE,UNICENTRO,PR,4,-,-,-,LETRAS / LINGUÍSTICA
Letras,40015017003P0,UNIVERSIDADE ESTADUAL DO OESTE DO PARANA,UNIOESTE,PR,5,5,-,-,LETRAS / LINGUÍSTICA
Letras,42003016039P5,UNIVERSIDADE FEDERAL DE PELOTAS,UFPEL,RS,5,5,-,-,LETRAS / LINGUÍSTICA
Letras,51005018007P4,UNIVERSIDADE FEDERAL DA GRANDE DOURADOS,UFGD,MS,4,-,-,-,LETRAS / LINGUÍSTICA
Letras,20001010032P6,UNIVERSIDADE FEDERAL DO MARANHÃO,UFMA,MA,3,-,-,-,LETRAS / LINGUÍSTICA
Letras,10001018010P4,UNIVERSIDADE FEDERAL DE RONDÔNIA,UNIR,RO,3,-,-,-,LETRAS / LINGUÍSTICA
Letras,33009015089P5,UNIVERSIDADE FEDERAL DE SÃO PAULO,UNIFESP,SP,3,-,-,-,LETRAS / LINGUÍSTICA
Letras,51004011005P5,UNIVERSIDADE ESTADUAL DE MATO GROSSO DO SUL,UEMS,MS,3,-,-,-,LETRAS / LINGUÍSTICA
LETRAS (CIÊNCIA DA LITERATURA),31001017071P2,UNIVERSIDADE FEDERAL DO RIO DE JANEIRO,UFRJ,RJ,5,5,-,-,LETRAS / LINGUÍSTICA
"Letras: Cultura, Educação e Linguagens",28006011008P1,UNIVERSIDADE ESTADUAL DO SUDOESTE DA BAHIA,UESB,BA,4,-,-,-,LETRAS / LINGUÍSTICA
LETRAS E ARTES,12008010039P6,UNIVERSIDADE DO ESTADO DO AMAZONAS,UEA,AM,3,-,-,-,LETRAS / LINGUÍSTICA
Letras e Cultura,42008018005P5,UNIVERSIDADE DE CAXIAS DO SUL,UCS,RS,4,-,-,-,LETRAS / LINGUÍSTICA
LETRAS E LINGUÍSTICA,52001016004P2,UNIVERSIDADE FEDERAL DE GOIÁS,UFG,GO,5,5,-,-,LETRAS / LINGUÍSTICA
LETRAS E LINGUÍSTICA,31004016160P4,UNIVERSIDADE DO ESTADO DO RIO DE JANEIRO,UERJ,RJ,3,-,-,-,LETRAS / LINGUÍSTICA
LETRAS (EST.COMP. DE LITER. DE LÍNGUA PORTUGUESA),33002010168P8,UNIVERSIDADE DE SÃO PAULO,USP,SP,5,5,-,-,LETRAS / LINGUÍSTICA
Letras Estrangeiras e Tradução,33002010108P5,UNIVERSIDADE DE SÃO PAULO,USP,SP,5,5,-,-,LETRAS / LINGUÍSTICA
Letras Estrangeiras Modernas,40002012050P7,UNIVERSIDADE ESTADUAL DE LONDRINA,UEL,PR,-,-,3,-,LETRAS / LINGUÍSTICA
Letras: estudos da linguagem,32007019021P6,UNIVERSIDADE FEDERAL DE OURO PRETO,UFOP,MG,3,-,-,-,LETRAS / LINGUÍSTICA
LETRAS: ESTUDOS LITERÁRIOS,32005016020P7,UNIVERSIDADE FEDERAL DE JUIZ DE FORA,UFJF,MG,4,4,-,-,LETRAS / LINGUÍSTICA
LETRAS (LETRAS CLÁSSICAS),31001017069P8,UNIVERSIDADE FEDERAL DO RIO DE JANEIRO,UFRJ,RJ,3,3,-,-,LETRAS / LINGUÍSTICA
LETRAS (LETRAS CLÁSSICAS),33002010106P2,UNIVERSIDADE DE SÃO PAULO,USP,SP,4,4,-,-,LETRAS / LINGUÍSTICA
LETRAS (LETRAS VERNÁCULAS),31001017070P6,UNIVERSIDADE FEDERAL DO RIO DE JANEIRO,UFRJ,RJ,6,6,-,-,LETRAS / LINGUÍSTICA
"LETRAS (LÍNGUA,  LITERATURA E CULTURA ITALIANAS)",33002010104P0,UNIVERSIDADE DE SÃO PAULO,USP,SP,4,4,-,-,LETRAS / LINGUÍSTICA
LETRAS (LÍNGUA E LITERATURA ALEMÃ),33002010105P6,UNIVERSIDADE DE SÃO PAULO,USP,SP,4,4,-,-,LETRAS / LINGUÍSTICA
LETRAS (LÍNGUA ESPANHOLA E LIT. ESPANHOLA E HISPANO-AMERIC.),33002010113P9,UNIVERSIDADE DE SÃO PAULO,USP,SP,4,4,-,-,LETRAS / LINGUÍSTICA
LETRAS (LÍNGUA LITERATURA E CULTURA JAPONESA),33002010175P4,UNIVERSIDADE DE SÃO PAULO,USP,SP,4,-,-,-,LETRAS / LINGUÍSTICA
LETRAS- LINGUAGEM E IDENTIDADE,11001011003P0,UNIVERSIDADE FEDERAL DO ACRE,UFAC,AC,4,4,-,-,LETRAS / LINGUÍSTICA
LETRAS: LINGÜÍSTICA E TEORIA LITERÁRIA,15001016008P3,UNIVERSIDADE FEDERAL DO PARÁ,UFPA,PA,5,5,-,-,LETRAS / LINGUÍSTICA
LETRAS (LITERATURA PORTUGUESA),33002010111P6,UNIVERSIDADE DE SÃO PAULO,USP,SP,4,4,-,-,LETRAS / LINGUÍSTICA
LETRAS NEOLATINAS,31001017086P0,UNIVERSIDADE FEDERAL DO RIO DE JANEIRO,UFRJ,RJ,5,5,-,-,LETRAS / LINGUÍSTICA
LETRAS (TEORIA LITERÁRIA E LITERATURA COMPARADA),33002010112P2,UNIVERSIDADE DE SÃO PAULO,USP,SP,5,5,-,-,LETRAS / LINGUÍSTICA
Letras (UCS/UNIRITTER),42008018012P1,UNIVERSIDADE DE CAXIAS DO SUL,UCS,RS,-,4,-,-,LETRAS / LINGUÍSTICA
Letras:Ensino de Língua e Literatura,16003012008P9,UNIVERSIDADE FEDERAL DO TOCANTINS,UFT,TO,4,4,-,-,LETRAS / LINGUÍSTICA
LETRAS-ESTUDOS LITERÁRIOS,32014015007P6,UNIVERSIDADE ESTADUAL DE MONTES CLAROS,UNIMONTES,MG,4,-,-,-,LETRAS / LINGUÍSTICA
LÍNGUA E CULTURA,28001010078P1,UNIVERSIDADE FEDERAL DA BAHIA,UFBA,BA,4,4,-,-,LETRAS / LINGUÍSTICA
"LÍNGUA, LITERATURA E INTERCULTURALIDADE",52012018011P7,UNIVERSIDADE ESTADUAL DE GOIÁS,UEG,GO,3,-,-,-,LETRAS / LINGUÍSTICA
LÍNGUA PORTUGUESA,33005010022P6,PONTIFÍCIA UNIVERSIDADE CATÓLICA DE SÃO PAULO,PUC/SP,SP,5,5,-,-,LETRAS / LINGUÍSTICA
LINGUAGEM E ENSINO,24009016015P6,UNIVERSIDADE FEDERAL DE CAMPINA GRANDE,UFCG,PB,4,-,-,-,LETRAS / LINGUÍSTICA
LINGUAGENS E REPRESENTAÇÕES,28007018009P4,UNIVERSIDADE ESTADUAL DE SANTA CRUZ,UESC,BA,4,4,-,-,LETRAS / LINGUÍSTICA
LINGUÍSTICA,33001014021P0,UNIVERSIDADE FEDERAL DE SÃO CARLOS,UFSCAR,SP,4,4,-,-,LETRAS / LINGUÍSTICA
LINGÜÍSTICA,24001015048P0,"UNIVERSIDADE FEDERAL DA PARAÍBA, JOÃO PESSOA",UFPB-JP,PB,6,6,-,-,LETRAS / LINGUÍSTICA
LINGÜÍSTICA,22001018024P9,UNIVERSIDADE FEDERAL DO CEARÁ,UFC,CE,5,5,-,-,LETRAS / LINGUÍSTICA
LINGÜÍSTICA,41001010014P0,UNIVERSIDADE FEDERAL DE SANTA CATARINA,UFSC,SC,6,6,-,-,LETRAS / LINGUÍSTICA
LINGÜÍSTICA,53001010023P3,UNIVERSIDADE DE BRASÍLIA,UNB,DF,5,5,-,-,LETRAS / LINGUÍSTICA
LINGÜÍSTICA,33003017030P2,UNIVERSIDADE ESTADUAL DE CAMPINAS,UNICAMP,SP,7,7,-,-,LETRAS / LINGUÍSTICA
LINGÜÍSTICA,33093016005P4,UNIVERSIDADE DE FRANCA,UNIFRAN,SP,4,4,-,-,LETRAS / LINGUÍSTICA
LINGÜÍSTICA,30001013022P9,UNIVERSIDADE FEDERAL DO ESPÍRITO SANTO,UFES,ES,4,4,-,-,LETRAS / LINGUÍSTICA
LINGÜÍSTICA,33002010103P3,UNIVERSIDADE DE SÃO PAULO,USP,SP,6,6,-,-,LETRAS / LINGUÍSTICA
LINGÜÍSTICA,31001017067P5,UNIVERSIDADE FEDERAL DO RIO DE JANEIRO,UFRJ,RJ,6,6,-,-,LETRAS / LINGUÍSTICA
LINGÜÍSTICA,32005016022P0,UNIVERSIDADE FEDERAL DE JUIZ DE FORA,UFJF,MG,5,5,-,-,LETRAS / LINGUÍSTICA
Linguística,28006011011P2,UNIVERSIDADE ESTADUAL DO SUDOESTE DA BAHIA,UESB,BA,4,4,-,-,LETRAS / LINGUÍSTICA
Línguística,50002015003P7,UNIVERSIDADE DO ESTADO DE MATO GROSSO,UNEMAT,MT,4,4,-,-,LETRAS / LINGUÍSTICA
LINGÜÍSTICA APLICADA,22003010008P6,UNIVERSIDADE ESTADUAL DO CEARÁ,UECE,CE,5,5,-,-,LETRAS / LINGUÍSTICA
LINGÜÍSTICA APLICADA,53001010078P2,UNIVERSIDADE DE BRASÍLIA,UNB,DF,4,-,-,-,LETRAS / LINGUÍSTICA
LINGÜÍSTICA APLICADA,42007011013P1,UNIVERSIDADE DO VALE DO RIO DOS SINOS,UNISINOS,RS,5,5,-,-,LETRAS / LINGUÍSTICA
LINGÜÍSTICA APLICADA,33021015007P1,UNIVERSIDADE DE TAUBATÉ,UNITAU,SP,4,-,-,-,LETRAS / LINGUÍSTICA
LINGÜÍSTICA APLICADA,33003017043P7,UNIVERSIDADE ESTADUAL DE CAMPINAS,UNICAMP,SP,5,5,-,-,LETRAS / LINGUÍSTICA
LINGÜÍSTICA APLICADA E ESTUDOS DA LINGUAGEM,33005010023P2,PONTIFÍCIA UNIVERSIDADE CATÓLICA DE SÃO PAULO,PUC/SP,SP,5,5,-,-,LETRAS / LINGUÍSTICA
LINGUÍSTICA E ENSINO,24001015066P9,"UNIVERSIDADE FEDERAL DA PARAÍBA, JOÃO PESSOA",UFPB-JP,PB,-,-,4,-,LETRAS / LINGUÍSTICA
LINGÜÍSTICA E LETRAS,42005019009P1,PONTIFÍCIA UNIVERSIDADE CATÓLICA DO RIO GRANDE DO SUL,PUC/RS,RS,7,7,-,-,LETRAS / LINGUÍSTICA
LINGUÍSTICA E LÍNGUA PORTUGUESA,33004030009P4,"UNIVERSIDADE ESTADUAL PAULISTA JÚLIO DE MESQUITA FILHO, ARARAQUARA",UNESP-ARAR,SP,6,6,-,-,LETRAS / LINGUÍSTICA
Linguística e Literatura,26001012001P0,UNIVERSIDADE FEDERAL DE ALAGOAS,UFAL,AL,3,3,-,-,LETRAS / LINGUÍSTICA
LITERATURA,53001010022P7,UNIVERSIDADE DE BRASÍLIA,UNB,DF,5,5,-,-,LETRAS / LINGUÍSTICA
LITERATURA,41001010013P4,UNIVERSIDADE FEDERAL DE SANTA CATARINA,UFSC,SC,5,5,-,-,LETRAS / LINGUÍSTICA
LITERATURA BRASILEIRA,33002010110P0,UNIVERSIDADE DE SÃO PAULO,USP,SP,5,5,-,-,LETRAS / LINGUÍSTICA
LITERATURA COMPARADA,40043010005P5,UNIVERSIDADE FEDERAL DA INTEGRAÇÃO LATINO-AMERICANA,UNILA,PR,3,-,-,-,LETRAS / LINGUÍSTICA
"LITERATURA, CULTURA E CONTEMPORANEIDADE",31005012038P0,PONTIFÍCIA UNIVERSIDADE CATÓLICA DO RIO DE JANEIRO,PUC-RIO,RJ,5,5,-,-,LETRAS / LINGUÍSTICA
LITERATURA E CRÍTICA LITERÁRIA,33005010029P0,PONTIFÍCIA UNIVERSIDADE CATÓLICA DE SÃO PAULO,PUC/SP,SP,4,4,-,-,LETRAS / LINGUÍSTICA
LITERATURA E CULTURA,28001010079P8,UNIVERSIDADE FEDERAL DA BAHIA,UFBA,BA,5,5,-,-,LETRAS / LINGUÍSTICA
LITERATURA E CULTURA RUSSA,33002010184P3,UNIVERSIDADE DE SÃO PAULO,USP,SP,3,-,-,-,LETRAS / LINGUÍSTICA
LITERATURA E INTERCULTURALIDADE,24004014004P2,UNIVERSIDADE ESTADUAL DA PARAÍBA,UEPB,PB,4,4,-,-,LETRAS / LINGUÍSTICA
PRÁTICAS TRANSCULLTURAIS,41025016001P1,CENTRO UNIVERSITÁRIO FACVEST,UNIFACVEST,SC,-,-,3,-,LETRAS / LINGUÍSTICA
TEORIA E HISTÓRIA LITERÁRIA,33003017031P9,UNIVERSIDADE ESTADUAL DE CAMPINAS,UNICAMP,SP,7,7,-,-,LETRAS / LINGUÍSTICA
TEORIA LITERÁRIA,40035018001P0,CENTRO UNIVERSITÁRIO CAMPOS DE ANDRADE,UNIANDRADE,PR,4,4,-,-,LETRAS / LINGUÍSTICA
TEORIA LITERARIA E CRITICA DA CULTURA,32018010002P0,UNIVERSIDADE FEDERAL DE SÃO JOÃO DEL-REI,UFSJ,MG,4,-,-,-,LETRAS / LINGUÍSTICA