Nome do Programa,Código do Programa,Nome da IES,Sigla da IES,UF,ME,DO,MP,DP,Av.Capes
ECONOMIA DOMÉSTICA,32002017019P0,UNIVERSIDADE FEDERAL DE VIÇOSA,UFV,MG,4,4,-,-,SERVIÇO SOCIAL
POLÍTICA SOCIAL,31003010049P3,UNIVERSIDADE FEDERAL FLUMINENSE,UFF,RJ,4,4,-,-,SERVIÇO SOCIAL
POLÍTICA SOCIAL,30001013020P6,UNIVERSIDADE FEDERAL DO ESPÍRITO SANTO,UFES,ES,5,5,-,-,SERVIÇO SOCIAL
POLÍTICA SOCIAL,53001010035P1,UNIVERSIDADE DE BRASÍLIA,UNB,DF,6,6,-,-,SERVIÇO SOCIAL
POLÍTICA SOCIAL,50001019023P1,UNIVERSIDADE FEDERAL DE MATO GROSSO,UFMT,MT,3,-,-,-,SERVIÇO SOCIAL
Política Social e Direitos Humanos,42006015005P2,UNIVERSIDADE CATÓLICA DE PELOTAS,UCPEL,RS,4,4,-,-,SERVIÇO SOCIAL
POLÍTICA SOCIAL E SERVIÇO SOCIAL,42001013158P1,UNIVERSIDADE FEDERAL DO RIO GRANDE DO SUL,UFRGS,RS,3,-,-,-,SERVIÇO SOCIAL
Política Social e Territórios,28022017015P6,UNIVERSIDADE FEDERAL DO RECÔNCAVO DA BAHIA,UFRB,BA,A,-,-,-,SERVIÇO SOCIAL
POLÍTICAS PÚBLICAS,20001010003P6,UNIVERSIDADE FEDERAL DO MARANHÃO,UFMA,MA,6,6,-,-,SERVIÇO SOCIAL
POLÍTICAS PÚBLICAS,21001014005P1,FUNDAÇÃO UNIVERSIDADE FEDERAL DO PIAUÍ,FUFPI,PI,4,4,-,-,SERVIÇO SOCIAL
POLÍTICAS PÚBLICAS E DESENVOLVIMENTO LOCAL,30013011001P6,ESCOLA SUPERIOR DE CIÊNCIA DA SANTA CASA DE MISERICÓRDIA DE VITÓRIA,EMESCAM,ES,3,-,-,-,SERVIÇO SOCIAL
SERVIÇO SOCIAL,33005010020P3,PONTIFÍCIA UNIVERSIDADE CATÓLICA DE SÃO PAULO,PUC/SP,SP,7,7,-,-,SERVIÇO SOCIAL
SERVIÇO SOCIAL,41001010047P6,UNIVERSIDADE FEDERAL DE SANTA CATARINA,UFSC,SC,5,5,-,-,SERVIÇO SOCIAL
SERVIÇO SOCIAL,42005019008P5,PONTIFÍCIA UNIVERSIDADE CATÓLICA DO RIO GRANDE DO SUL,PUC/RS,RS,6,6,-,-,SERVIÇO SOCIAL
SERVIÇO SOCIAL,33004072067P2,"UNIVERSIDADE ESTADUAL PAULISTA JÚLIO DE MESQUITA FILHO, FRANCA",UNESP-FR,SP,4,4,-,-,SERVIÇO SOCIAL
SERVIÇO SOCIAL,32005016013P0,UNIVERSIDADE FEDERAL DE JUIZ DE FORA,UFJF,MG,4,4,-,-,SERVIÇO SOCIAL
SERVIÇO SOCIAL,31005012021P0,PONTIFÍCIA UNIVERSIDADE CATÓLICA DO RIO DE JANEIRO,PUC-RIO,RJ,5,5,-,-,SERVIÇO SOCIAL
SERVIÇO SOCIAL,31004016028P9,UNIVERSIDADE DO ESTADO DO RIO DE JANEIRO,UERJ,RJ,6,6,-,-,SERVIÇO SOCIAL
SERVIÇO SOCIAL,31001017066P9,UNIVERSIDADE FEDERAL DO RIO DE JANEIRO,UFRJ,RJ,5,5,-,-,SERVIÇO SOCIAL
SERVIÇO SOCIAL,26001012016P7,UNIVERSIDADE FEDERAL DE ALAGOAS,UFAL,AL,4,4,-,-,SERVIÇO SOCIAL
SERVIÇO SOCIAL,25001019031P3,UNIVERSIDADE FEDERAL DE PERNAMBUCO,UFPE,PE,6,6,-,-,SERVIÇO SOCIAL
SERVIÇO SOCIAL,24004014015P4,UNIVERSIDADE ESTADUAL DA PARAÍBA,UEPB,PB,3,-,-,-,SERVIÇO SOCIAL
SERVIÇO SOCIAL,24001015019P0,"UNIVERSIDADE FEDERAL DA PARAÍBA, JOÃO PESSOA",UFPB-JP,PB,3,-,-,-,SERVIÇO SOCIAL
SERVIÇO SOCIAL,23001011027P0,UNIVERSIDADE FEDERAL DO RIO GRANDE DO NORTE,UFRN,RN,4,4,-,-,SERVIÇO SOCIAL
SERVIÇO SOCIAL,12001015027P0,UNIVERSIDADE FEDERAL DO AMAZONAS,UFAM,AM,3,-,-,-,SERVIÇO SOCIAL
SERVIÇO SOCIAL,15001016036P7,UNIVERSIDADE FEDERAL DO PARÁ,UFPA,PA,4,4,-,-,SERVIÇO SOCIAL
SERVIÇO SOCIAL,28001010175P7,UNIVERSIDADE FEDERAL DA BAHIA,UFBA,BA,A,-,-,-,SERVIÇO SOCIAL
SERVIÇO SOCIAL,16003012175P2,UNIVERSIDADE FEDERAL DO TOCANTINS,UFT,TO,A,-,-,-,SERVIÇO SOCIAL
SERVIÇO SOCIAL,40015017026P0,UNIVERSIDADE ESTADUAL DO OESTE DO PARANA,UNIOESTE,PR,3,-,-,-,SERVIÇO SOCIAL
SERVIÇO SOCIAL,52002012011P5,PONTIFÍCIA UNIVERSIDADE CATÓLICA DE GOIÁS,PUC-GOIÁS,GO,3,-,-,-,SERVIÇO SOCIAL
Serviço Social,27001016037P7,FUNDAÇÃO UNIVERSIDADE FEDERAL DE SERGIPE,FUFSE,SE,3,-,-,-,SERVIÇO SOCIAL
SERVIÇO SOCIAL E DESENVOLVIMENTO REGIONAL,31003010084P3,UNIVERSIDADE FEDERAL FLUMINENSE,UFF,RJ,3,-,-,-,SERVIÇO SOCIAL
Serviço Social e Direitos Sociais,23002018010P7,UNIVERSIDADE DO ESTADO DO RIO GRANDE DO NORTE,UERN,RN,3,-,-,-,SERVIÇO SOCIAL
SERVIÇO SOCIAL E POLÍTICA SOCIAL,40002012020P0,UNIVERSIDADE ESTADUAL DE LONDRINA,UEL,PR,4,4,-,-,SERVIÇO SOCIAL
SERVIÇO SOCIAL E POLÍTICAS SOCIAIS,33009015171P3,UNIVERSIDADE FEDERAL DE SÃO PAULO,UNIFESP,SP,3,-,-,-,SERVIÇO SOCIAL
"Serviço Social, Trabalho e Questão Social",22003010025P8,UNIVERSIDADE ESTADUAL DO CEARÁ,UECE,CE,4,-,-,-,SERVIÇO SOCIAL